{
  "$schema": "../todo.track.schema.json",
  "version": 1,
  "owner": "webrtc-minimize-server",
  "track": "twenty-participant-rooms",
  "purpose": "Die vorhandene flüchtige Room-Membership im ersten produktiven Schnitt auf bis zu 20 Teilnehmer pro isoliertem Raum erweitern.",
  "goal": "Server, Browser, Konfiguration und Tests verwenden eine kanonische harte Obergrenze von 20 Teilnehmern je Raum; der 21. Join scheitert, während andere Räume unabhängig bleiben.",
  "status": "in_progress",
  "status_scale": ["todo", "in_progress", "partial", "blocked", "done"],
  "priority_scale": ["P0", "P1", "P2", "P3"],
  "risk_scale": ["low", "medium", "high", "critical"],
  "milestones": [
    {
      "id": "ROOM20-M01",
      "title": "20-Teilnehmer-Räume",
      "task_ids": ["ROOM20-001", "ROOM20-002", "ROOM20-003", "ROOM20-004"],
      "status": "in_progress"
    }
  ],
  "tasks": [
    {
      "id": "ROOM20-001",
      "title": "Bestehende Room-Membership und alle Vierergrenzen inventarisieren",
      "status": "done",
      "priority": "P0",
      "risk": "medium",
      "progress_percent": 100,
      "depends_on": [],
      "acceptance_criteria": [
        "Server-, Client-, Environment-, Test- und Dokumentationsgrenzen sind vollständig gefunden.",
        "Vorhandene Raumisolation und Invite-Erzeugung sind als bestehende Fähigkeiten bestätigt.",
        "Historische archivierte Todo-Akzeptanzkriterien bleiben unverändert."
      ]
    },
    {
      "id": "ROOM20-002",
      "title": "Kanonische 20er-Raumgrenze in Server und Client implementieren",
      "status": "done",
      "priority": "P0",
      "risk": "high",
      "progress_percent": 100,
      "depends_on": ["ROOM20-001"],
      "acceptance_criteria": [
        "Eine gemeinsame Serverkonstante begrenzt Default und Maximum auf 20.",
        "Runtime-Konfiguration, Welcome-Nachricht und Browseranzeige verwenden 20.",
        "Ein niedrigeres Betreiberlimit zwischen 2 und 20 bleibt zulässig."
      ]
    },
    {
      "id": "ROOM20-003",
      "title": "20er-Kapazität und Cross-Room-Isolation deterministisch testen",
      "status": "done",
      "priority": "P0",
      "risk": "high",
      "progress_percent": 100,
      "depends_on": ["ROOM20-002"],
      "acceptance_criteria": [
        "Genau 20 Mitglieder können demselben RoomRegistry-Raum beitreten.",
        "Der 21. Join erhält room_full.",
        "Ein weiterer Teilnehmer kann gleichzeitig einem anderen Raum beitreten.",
        "Ein echter WebSocket-Integrationstest reproduziert dieselben Grenzen."
      ]
    },
    {
      "id": "ROOM20-004",
      "title": "Mesh-Kosten dokumentieren, committen, pushen und CI verifizieren",
      "status": "in_progress",
      "priority": "P0",
      "risk": "high",
      "progress_percent": 70,
      "depends_on": ["ROOM20-003"],
      "acceptance_criteria": [
        "Dokumentation trennt harte Raumkapazität von einer QoS-Garantie.",
        "Bei 20 Teilnehmern werden bis zu 19 PeerConnections und Medienkopien pro Sender transparent benannt.",
        "Lokale Gates und öffentlicher GitHub-Actions-Lauf sind erfolgreich.",
        "Lokaler und entfernter main-Commit sind identisch."
      ]
    }
  ],
  "critical_path_tasks": ["ROOM20-001", "ROOM20-002", "ROOM20-003", "ROOM20-004"],
  "tasks_status_summary": {
    "total": 4,
    "by_status": { "todo": 0, "in_progress": 1, "partial": 0, "blocked": 0, "done": 3 },
    "progress_percent_done": 75,
    "by_priority": { "P0": 4, "P1": 0, "P2": 0, "P3": 0 },
    "by_risk": { "low": 0, "medium": 1, "high": 3, "critical": 0 },
    "critical_path": { "total": 4, "done": 3, "remaining": 1 },
    "milestones": { "total": 1, "todo": 0, "in_progress": 1, "blocked": 0, "done": 0 }
  },
  "progress_summary": {
    "state": "in_progress",
    "todo_remaining": 0,
    "in_progress": 1,
    "partial": 0,
    "blocked": 0,
    "done": 3
  },
  "summary_notes": [
    "20 ist die harte Membership-Grenze, keine garantierte Medienqualität eines Full-Mesh.",
    "tasks[] ist die Source of Truth; Summen werden vor Commits geprüft."
  ]
}
