{
  "$schema": "../todo.track.schema.json",
  "version": 1,
  "owner": "webrtc-minimize-server",
  "track": "github-actions-public-release",
  "purpose": "Das Repository öffentlich zugänglich machen und Änderungen durch reproduzierbare GitHub-Actions-Gates schützen.",
  "goal": "Pushes und Pull Requests auf main führen Todo-, Node-, Browser- und Docker-Gates mit minimalen Tokenrechten aus; der erste Lauf ist erfolgreich und das Repository öffentlich.",
  "status": "in_progress",
  "status_scale": ["todo", "in_progress", "partial", "blocked", "done"],
  "priority_scale": ["P0", "P1", "P2", "P3"],
  "risk_scale": ["low", "medium", "high", "critical"],
  "milestones": [
    {
      "id": "CI-M01",
      "title": "Öffentliche CI-gesicherte Veröffentlichung",
      "task_ids": ["CI-001", "CI-002", "CI-003", "CI-004"],
      "status": "in_progress"
    }
  ],
  "tasks": [
    {
      "id": "CI-001",
      "title": "Aktuelle GitHub-Actions-Versionen, Rechte und Repositoryzustand prüfen",
      "status": "done",
      "priority": "P0",
      "risk": "medium",
      "progress_percent": 100,
      "depends_on": [],
      "acceptance_criteria": [
        "Actions ist für das Repository aktiviert.",
        "Das Default-GITHUB_TOKEN besitzt nur Leserechte.",
        "Offizielle Actions werden auf verifizierte aktuelle Commit-SHAs gepinnt."
      ]
    },
    {
      "id": "CI-002",
      "title": "GitHub-Actions-Workflow für Tests, Browser-E2E und Docker bauen",
      "status": "done",
      "priority": "P0",
      "risk": "high",
      "progress_percent": 100,
      "depends_on": ["CI-001"],
      "acceptance_criteria": [
        "Push, Pull Request und manueller Dispatch werden unterstützt.",
        "Der Testjob führt npm ci, Chromium-Installation und npm run check aus.",
        "Der Dockerjob validiert Compose und baut das Produktionsimage erst nach erfolgreichen Tests.",
        "Workflow-Tokenrechte sind explizit auf contents: read begrenzt und veraltete Läufe werden abgebrochen."
      ]
    },
    {
      "id": "CI-003",
      "title": "Workflow committen, pushen und ersten Lauf bis zum Ergebnis beobachten",
      "status": "in_progress",
      "priority": "P0",
      "risk": "high",
      "progress_percent": 25,
      "depends_on": ["CI-002"],
      "acceptance_criteria": [
        "Workflow-Syntax und lokale Gates sind erfolgreich.",
        "Der Workflow-Commit ist auf origin/main gepusht.",
        "Test- und Dockerjob des ersten GitHub-Laufs enden erfolgreich."
      ]
    },
    {
      "id": "CI-004",
      "title": "Repository öffentlich schalten und finalen Remotezustand verifizieren",
      "status": "todo",
      "priority": "P0",
      "risk": "critical",
      "progress_percent": 0,
      "depends_on": ["CI-003"],
      "acceptance_criteria": [
        "GitHub meldet visibility PUBLIC und main als Default-Branch.",
        "Lokaler und entfernter main-Commit sind identisch.",
        "CI-Badge und Actions-Lauf sind öffentlich erreichbar.",
        "GitHub erkennt weiterhin BSD-3-Clause."
      ]
    }
  ],
  "critical_path_tasks": ["CI-001", "CI-002", "CI-003", "CI-004"],
  "tasks_status_summary": {
    "total": 4,
    "by_status": { "todo": 1, "in_progress": 1, "partial": 0, "blocked": 0, "done": 2 },
    "progress_percent_done": 50,
    "by_priority": { "P0": 4, "P1": 0, "P2": 0, "P3": 0 },
    "by_risk": { "low": 0, "medium": 1, "high": 2, "critical": 1 },
    "critical_path": { "total": 4, "done": 2, "remaining": 2 },
    "milestones": { "total": 1, "todo": 0, "in_progress": 1, "blocked": 0, "done": 0 }
  },
  "progress_summary": {
    "state": "in_progress",
    "todo_remaining": 1,
    "in_progress": 1,
    "partial": 0,
    "blocked": 0,
    "done": 2
  },
  "summary_notes": [
    "Das Repository bleibt bis zum erfolgreichen ersten CI-Lauf private.",
    "tasks[] ist die Source of Truth; Summen werden vor Commits geprüft."
  ]
}
