{
  "$schema": "../todo.track.schema.json",
  "version": 1,
  "owner": "webrtc-minimize-server",
  "track": "screen-audio-captions",
  "purpose": "Lokale Vosk-Untertitel wahlweise aus dem bereits freigegebenen Mikrofon- oder Bildschirmton erzeugen und bewusst nur lokal oder direkt mit Raumpeers teilen.",
  "goal": "Ein Nutzer kann Mikrofon und freigegebenen Bildschirmton getrennt oder parallel transkribieren, die Quelle jedes Untertitels erkennen und vor dem Start festlegen, ob Text nur lokal sichtbar bleibt oder ueber den bestehenden captions-DataChannel an Raumpeers geht.",
  "status": "done",
  "status_scale": ["todo", "in_progress", "partial", "blocked", "done"],
  "priority_scale": ["P0", "P1", "P2", "P3"],
  "risk_scale": ["low", "medium", "high", "critical"],
  "milestones": [
    {
      "id": "SAC-M01",
      "title": "Quellengebundener Capture-Lifecycle",
      "task_ids": ["SAC-001"],
      "status": "done"
    },
    {
      "id": "SAC-M02",
      "title": "Versionierter Peer-Contract und Bedienung",
      "task_ids": ["SAC-002"],
      "status": "done"
    },
    {
      "id": "SAC-M03",
      "title": "Mehrquellen-Verifikation und Rollout",
      "task_ids": ["SAC-003"],
      "status": "done"
    }
  ],
  "tasks": [
    {
      "id": "SAC-001",
      "title": "Vosk-Pipelines an vorhandene Audio-Publikationen binden",
      "status": "done",
      "priority": "P0",
      "risk": "critical",
      "progress_percent": 100,
      "depends_on": [],
      "acceptance_criteria": [
        "Mikrofon und Bildschirmton werden ausschliesslich aus bereits laufenden lokalen Tracks gelesen; Untertitelcode ruft weder getUserMedia noch getDisplayMedia auf.",
        "Beide Quellen koennen mit getrennten Recognizern parallel laufen; das Ende einer Quelle beendet nur deren AudioGraph, Track-Clone und Recognizer.",
        "Der letzte Quellenstopp, Leave, Logout und Destroy beenden Worker und erreichbaren Transkriptzustand deterministisch, ohne die urspruengliche Medienpublikation zu stoppen."
      ]
    },
    {
      "id": "SAC-002",
      "title": "Quellenfeld, lokale Sichtbarkeit und Angular-Steuerung ergaenzen",
      "status": "done",
      "priority": "P0",
      "risk": "high",
      "progress_percent": 100,
      "depends_on": ["SAC-001"],
      "acceptance_criteria": [
        "Caption Contract v2 bindet microphone oder screen-audio als geschlossenes Quellenfeld und akzeptiert bestehende v1-Mikrofonuntertitel weiterhin fail-closed.",
        "Vor dem Start ist pro Browser eindeutig waehlbar, ob Untertitel nur lokal angezeigt oder an aktuelle Raumpeers verteilt werden; die Control Plane terminiert oder persistiert weiterhin keinen Text.",
        "Die Untertitelansicht zeigt Verfuegbarkeit, Aktivstatus und Herkunft beider Audioquellen; nicht vorhandener Bildschirmton bleibt sichtbar erklaert und startet keinen Capture-Aufruf."
      ]
    },
    {
      "id": "SAC-003",
      "title": "Tests, Dokumentation und Produktionsrollout abschliessen",
      "status": "done",
      "priority": "P1",
      "risk": "high",
      "progress_percent": 100,
      "depends_on": ["SAC-002"],
      "acceptance_criteria": [
        "Unit- und Browsertests pruefen parallele Quellen, selektiven Stopp, lokalen Modus, v1/v2-Interop, Quelle/Sprecherbindung, Limits und Capture-Freiheit.",
        "npm run check und npm run todos:validate bestehen; ein realer Browser-Smoke verwendet einen bewusst erzeugten Bildschirm-Audiotrack und weist lokale sowie Peer-Anzeige nach.",
        "Nur zugehoerige Dateien werden gezielt committed und gepusht; Mini-PC-Rollout, HTTPS-Health und Produktionsoberflaeche werden ohne Secret- oder Infrastrukturveraenderung verifiziert."
      ]
    }
  ],
  "critical_path_tasks": ["SAC-001", "SAC-002", "SAC-003"],
  "tasks_status_summary": {
    "total": 3,
    "by_status": { "todo": 0, "in_progress": 0, "partial": 0, "blocked": 0, "done": 3 },
    "progress_percent_done": 100,
    "by_priority": { "P0": 2, "P1": 1, "P2": 0, "P3": 0 },
    "by_risk": { "low": 0, "medium": 0, "high": 2, "critical": 1 },
    "critical_path": { "total": 3, "done": 3, "remaining": 0 },
    "milestones": { "total": 3, "todo": 0, "in_progress": 0, "blocked": 0, "done": 3 }
  },
  "progress_summary": {
    "state": "done",
    "todo_remaining": 0,
    "in_progress": 0,
    "partial": 0,
    "blocked": 0,
    "done": 3
  },
  "summary_notes": [
    "Bildschirmton bleibt ein getrenntes, standardmaessig deaktiviertes Capture-Opt-in. Untertitel erweitern dessen Autoritaet nicht und koennen keinen fehlenden Browser-Audiotrack erzeugen.",
    "Lokale Anzeige und Peer-Verteilung betreffen nur fluechtigen Text. Audio bleibt im bestehenden WebRTC-Medienpfad beziehungsweise im lokalen Track-Clone und erreicht die Signaling Control Plane nicht.",
    "Die Quellen-Pipelines teilen ein geladenes Modell, besitzen aber getrennte Recognizer, AudioGraphs, Revisionen und Timer. Ein Quellenende entfernt nur seinen Clone; das Original bleibt Eigentum des Medien-Lifecycles.",
    "Ein lokaler Zwei-Chromium-Smoke mit echtem en-US-Vosk-WASM-Modell erkannte aus einem bewusst per getDisplayMedia bereitgestellten Bildschirm-Audiotrack den Text 'hello' und zeigte ihn beim zweiten Peer als 'Ada · Bildschirmton'; der Empfaenger hatte null Modell-Downloads und null Capture-Aufrufe.",
    "npm run check bestand mit 139 Frontend- und 96 Node-/Browsertests; das explizit credential-gebundene Keycloak-/TURN-Live-Gate meldete den vorgesehenen sichtbaren Skip, da diese Aenderung weder Identity noch ICE veraendert.",
    "Commit 1154c01 wurde nach origin/main gepusht und auf dem Mini-PC gebaut. Interner und oeffentlicher /healthz antworteten mit status ok; der Produktionsbrowser lud 13 Modelle, wechselte lokal auf Bildschirmton und verzeichnete dabei null Capture-Aufrufe oder Page-Fehler.",
    "tasks[] ist die Source of Truth; Summen werden bei jedem Statuswechsel mit npm run todos:validate geprueft."
  ]
}
